{
  "schema": "genesis.kenney-calibration.v1",
  "algorithmVersion": 1,
  "packs": {
    "kenney-mini-dungeon": {"sourceUp": "+Y", "sourceForward": "+Z", "canonicalScale": 2.0, "structuralGrid": {"sourceModuleUnits": 1.0, "targetWorldUnits": 2.0, "orientationSteps": 4, "joinMode": "cell-orientation"}},
    "kenney-modular-dungeon-kit": {"sourceUp": "+Y", "sourceForward": "+Z", "canonicalScale": 0.5, "structuralGrid": {"sourceModuleUnits": 4.0, "targetWorldUnits": 2.0, "orientationSteps": 4, "joinMode": "cell-orientation"}}
  },
  "assets": {
    "kenney-mini-dungeon/floor": {"sourceSha256":"1f4e4c6edcb86c5e19fbe97390160c2e844e13a776e0ad3f1c97f001c540fcb5","admissionClass":"DIRECT_MODULATED","category":"floor","rootMaterialFamily":"stone","preTransform":{"translation":[0,0,0],"rotation":[0,0,0,1],"scale":[1,1,1]},"scaleReason":null,"groundOffset":0,"semanticParts":{},"sockets":[],"footprintOverride":null,"qaStatus":"needs-review","notes":[]},
    "kenney-mini-dungeon/floor-detail": {"sourceSha256":"ae4462e07b402c97bd9f563246a3fbaa43b5ac635ea2dff50c310d4b17cf2b58","admissionClass":"DIRECT_MODULATED","category":"floor","rootMaterialFamily":"stone","preTransform":{"translation":[0,0,0],"rotation":[0,0,0,1],"scale":[1,1,1]},"scaleReason":null,"groundOffset":0,"semanticParts":{},"sockets":[],"footprintOverride":null,"qaStatus":"needs-review","notes":[]},
    "kenney-mini-dungeon/gate": {"sourceSha256":"50dd5a912d6cb2cb7bf9f1f5c2e0ec721d5265626ce7c16ac8a7eaba3c7cbc13","admissionClass":"PART_DONOR","category":"door-leaf","rootMaterialFamily":"wood","preTransform":{"translation":[0,0,0],"rotation":[0,0,0,1],"scale":[1,1,1]},"scaleReason":null,"groundOffset":0,"semanticParts":{"door-leaf":{"nodePath":"gate/door","detachable":true,"materialFamily":"wood"}},"sockets":[{"id":"hinge-left","type":"hinge","position":[-0.800000011920929,0.75,0],"rotation":[0,0,0,1],"mateRule":"coincident","mateFamily":"doorway-frame","size":[0.05,1.5,0.05],"clearance":{"shape":"box","size":[1.6,2.2,1.6]}}],"footprintOverride":null,"qaStatus":"needs-review","notes":[]},
    "kenney-mini-dungeon/stairs": {"sourceSha256":"1b954aa217f3f40e1fc97569ee71d9729927afc89c14a6a5a7f7293062b149b2","admissionClass":"PART_DONOR","category":"stairs","rootMaterialFamily":"stone","preTransform":{"translation":[0,0,0],"rotation":[0,0,0,1],"scale":[1,1,1]},"scaleReason":null,"groundOffset":0,"semanticParts":{},"sockets":[],"footprintOverride":null,"qaStatus":"needs-review","notes":[]},
    "kenney-mini-dungeon/wall": {"sourceSha256":"6c74c80556ebba2143a9c9e2570862791e8bfd7f3bc1308f6fbaeba312911cf7","admissionClass":"PART_DONOR","category":"wall","rootMaterialFamily":"stone","preTransform":{"translation":[0,0,0],"rotation":[0,0,0,1],"scale":[1,1,1]},"scaleReason":null,"groundOffset":0,"semanticParts":{},"sockets":[],"footprintOverride":null,"qaStatus":"needs-review","notes":[]},
    "kenney-mini-dungeon/wall-half": {"sourceSha256":"71799e86c614e46731b01d2810c51b59dc5f2dc63842dd1d70113ea550e55fc5","admissionClass":"PART_DONOR","category":"wall","rootMaterialFamily":"stone","preTransform":{"translation":[0,0,0],"rotation":[0,0,0,1],"scale":[1,1,1]},"scaleReason":null,"groundOffset":0,"semanticParts":{},"sockets":[],"footprintOverride":null,"qaStatus":"needs-review","notes":[]},
    "kenney-mini-dungeon/wall-narrow": {"sourceSha256":"9c298db229e7afc76abd4de0156f64cd6511a7d972d012e12c87493130ba094b","admissionClass":"PART_DONOR","category":"wall","rootMaterialFamily":"stone","preTransform":{"translation":[0,0,0],"rotation":[0,0,0,1],"scale":[1,1,1]},"scaleReason":null,"groundOffset":0,"semanticParts":{},"sockets":[],"footprintOverride":null,"qaStatus":"needs-review","notes":[]},
    "kenney-mini-dungeon/wall-opening": {"sourceSha256":"02ca8ed569571b4723e1cc9ffdee37e0281b11aa384795f459566c2980f10086","admissionClass":"PART_DONOR","category":"doorway-frame","rootMaterialFamily":"stone","preTransform":{"translation":[0,0,0],"rotation":[0,0,0,1],"scale":[1,1,1]},"scaleReason":null,"groundOffset":0,"semanticParts":{},"sockets":[{"id":"hinge-left","type":"hinge","position":[-1,1,1.100000023841858],"rotation":[0,0,0,1],"mateRule":"coincident","mateFamily":"door-leaf","size":[0.05,2,0.05],"clearance":{"shape":"box","size":[2,2.4,2]}}],"footprintOverride":null,"qaStatus":"needs-review","notes":[],"companionLeaf":"gate"},
    "kenney-modular-dungeon-kit/corridor": {"sourceSha256":"e70f61e46cdfcea4b52e722abdbbdc5cf727461660ccd8556ad4b7a39a5997d5","admissionClass":"DIRECT_MODULATED","category":"corridor-shell","rootMaterialFamily":"stone","preTransform":{"translation":[0,0,0],"rotation":[0,0,0,1],"scale":[1,1,1]},"scaleReason":null,"groundOffset":0,"semanticParts":{},"sockets":[],"footprintOverride":null,"qaStatus":"needs-review","notes":[]},
    "kenney-modular-dungeon-kit/corridor-corner": {"sourceSha256":"9c8efc6da00f45f1bb9986e596bea9bec5433d776bfd440e315f1f14570edfe8","admissionClass":"DIRECT_MODULATED","category":"corridor-shell","rootMaterialFamily":"stone","preTransform":{"translation":[0,0,0],"rotation":[0,0,0,1],"scale":[1,1,1]},"scaleReason":null,"groundOffset":0,"semanticParts":{},"sockets":[],"footprintOverride":null,"qaStatus":"needs-review","notes":[]},
    "kenney-modular-dungeon-kit/corridor-end": {"sourceSha256":"aa0cc13ebf45c7d3af0c072f53bf74c9fc1d8b4eec949484bc7ce551615bff66","admissionClass":"DIRECT_MODULATED","category":"corridor-shell","rootMaterialFamily":"stone","preTransform":{"translation":[0,0,0],"rotation":[0,0,0,1],"scale":[1,1,1]},"scaleReason":null,"groundOffset":0,"semanticParts":{},"sockets":[],"footprintOverride":null,"qaStatus":"needs-review","notes":[]},
    "kenney-modular-dungeon-kit/corridor-intersection": {"sourceSha256":"8391b37a520da2e81ba00f9992f74eb338d4b93263ef180b895508b7096edce8","admissionClass":"DIRECT_MODULATED","category":"corridor-shell","rootMaterialFamily":"stone","preTransform":{"translation":[0,0,0],"rotation":[0,0,0,1],"scale":[1,1,1]},"scaleReason":null,"groundOffset":0,"semanticParts":{},"sockets":[],"footprintOverride":null,"qaStatus":"needs-review","notes":[]},
    "kenney-modular-dungeon-kit/corridor-junction": {"sourceSha256":"024813c67150354bae6fa9dceb618eae00c918461d38a3e8f2e5d5241df600e7","admissionClass":"DIRECT_MODULATED","category":"corridor-shell","rootMaterialFamily":"stone","preTransform":{"translation":[0,0,0],"rotation":[0,0,0,1],"scale":[1,1,1]},"scaleReason":null,"groundOffset":0,"semanticParts":{},"sockets":[],"footprintOverride":null,"qaStatus":"needs-review","notes":[]},
    "kenney-modular-dungeon-kit/corridor-transition": {"sourceSha256":"b8628cee5af8ea7ea89024ee5e0eb30c91b217680daed8188e0cb7babb27ab8f","admissionClass":"DIRECT_MODULATED","category":"corridor-shell","rootMaterialFamily":"stone","preTransform":{"translation":[0,0,0],"rotation":[0,0,0,1],"scale":[1,1,1]},"scaleReason":null,"groundOffset":0,"semanticParts":{},"sockets":[],"footprintOverride":null,"qaStatus":"needs-review","notes":[]},
    "kenney-modular-dungeon-kit/corridor-wide": {"sourceSha256":"0a24c93238ebd1178c522e5effc7f0bfc1963133f2d50635a84c2465d5dd0f43","admissionClass":"DIRECT_MODULATED","category":"corridor-shell","rootMaterialFamily":"stone","preTransform":{"translation":[0,0,0],"rotation":[0,0,0,1],"scale":[1,1,1]},"scaleReason":null,"groundOffset":0,"semanticParts":{},"sockets":[],"footprintOverride":null,"qaStatus":"needs-review","notes":[]},
    "kenney-modular-dungeon-kit/corridor-wide-corner": {"sourceSha256":"c1613a016eb107379c51c75ae7ced7e5244b27d7904910981584ce73f78a6db1","admissionClass":"DIRECT_MODULATED","category":"corridor-shell","rootMaterialFamily":"stone","preTransform":{"translation":[0,0,0],"rotation":[0,0,0,1],"scale":[1,1,1]},"scaleReason":null,"groundOffset":0,"semanticParts":{},"sockets":[],"footprintOverride":null,"qaStatus":"needs-review","notes":[]},
    "kenney-modular-dungeon-kit/corridor-wide-end": {"sourceSha256":"ecaef7f049d790a14da8ec6169afd9f81e12e5c9f3629429e07790a998cc197c","admissionClass":"DIRECT_MODULATED","category":"corridor-shell","rootMaterialFamily":"stone","preTransform":{"translation":[0,0,0],"rotation":[0,0,0,1],"scale":[1,1,1]},"scaleReason":null,"groundOffset":0,"semanticParts":{},"sockets":[],"footprintOverride":null,"qaStatus":"needs-review","notes":[]},
    "kenney-modular-dungeon-kit/corridor-wide-intersection": {"sourceSha256":"258d31b3658fb3015b50be9169259e3c1f4ee4fa0d8b68ed937e8bc7664a461a","admissionClass":"DIRECT_MODULATED","category":"corridor-shell","rootMaterialFamily":"stone","preTransform":{"translation":[0,0,0],"rotation":[0,0,0,1],"scale":[1,1,1]},"scaleReason":null,"groundOffset":0,"semanticParts":{},"sockets":[],"footprintOverride":null,"qaStatus":"needs-review","notes":[]},
    "kenney-modular-dungeon-kit/corridor-wide-junction": {"sourceSha256":"a1653befb7ae2fe7c99fdb9ec600930be04c0c5e1fd8c0d112ddaf3c9c4aa6f9","admissionClass":"DIRECT_MODULATED","category":"corridor-shell","rootMaterialFamily":"stone","preTransform":{"translation":[0,0,0],"rotation":[0,0,0,1],"scale":[1,1,1]},"scaleReason":null,"groundOffset":0,"semanticParts":{},"sockets":[],"footprintOverride":null,"qaStatus":"needs-review","notes":[]},
    "kenney-modular-dungeon-kit/gate": {"sourceSha256":"491c9e9980751cf4fee75e3cfc4390075402c0070962ff1d33fe98138ea289c9","admissionClass":"PART_DONOR","category":"arch","rootMaterialFamily":"stone","preTransform":{"translation":[0,0,0],"rotation":[0,0,0,1],"scale":[1,1,1]},"scaleReason":null,"groundOffset":0,"semanticParts":{},"sockets":[],"footprintOverride":null,"qaStatus":"needs-review","notes":[]},